"id","code","name","date_start","date_end"
"other_payment_001","001","Reintegro de ISR pagado en exceso (siempre que no haya sido enterado al SAT).",2017-01-01,
"other_payment_002","002","Subsidio para el empleo (efectivamente entregado al trabajador).",2017-01-01,
"other_payment_003","003","Viáticos (entregados al trabajador).",2017-01-01,
"other_payment_004","004","Aplicación de saldo a favor por compensación anual.",2017-01-01,
"other_payment_005","005","Reintegro de ISR retenido en exceso de ejercicio anterior (siempre que no haya sido enterado al SAT).",2017-12-05,
"other_payment_006","006","Alimentos en bienes (Servicios de comedor y comida) Art 94 último párrafo LISR.",2020-01-01,
"other_payment_007","007","ISR ajustado por subsidio.",2020-01-01,
"other_payment_008","008","Subsidio efectivamente entregado que no correspondía (Aplica sólo cuando haya ajuste al cierre de mes en relación con el Apéndice 7 de la guía de llenado de nómina).",2020-01-01,
"other_payment_009","009","Reembolso de descuentos efectuados para el crédito de vivienda.",2020-04-20,
"other_payment_999","999","Pagos distintos a los listados y que no deben considerarse como ingreso por sueldos, salarios o ingresos asimilados.",2017-01-01,